{
  "meta": {
    "series": "Geo-Strategy",
    "episode": 2,
    "title": "Christian Zionism and the Middle East Conflict",
    "video_id": "lkKrZq4YdqY",
    "url": "https://www.youtube.com/watch?v=lkKrZq4YdqY",
    "transcript_file": "Geo-Strategy#2：  Christian Zionism and the Middle East Conflict [lkKrZq4YdqY].en.srt",
    "analyzed_by": "claude-opus-4-6",
    "analysis_date": "2026-03-14",
    "schema_version": "1.0",
    "upload_date": "2024-05-08",
    "view_count": 445034,
    "view_count_updated": "2026-04-03",
    "last_scoring_date": "2026-09-01"
  },
  "synopsis": "This lecture argues that US foreign policy toward Israel and Iran is fundamentally driven by Christian Zionism, a theology rooted in dispensationalist premillennialism. The speaker traces a historical arc from early Christianity as a revolutionary religion for the oppressed, through Augustine's establishment theology, the Reformation, English religious dissent, and the founding of America as a 'Christian nation.' He explains four eschatological positions within Christianity and argues that dispensationalist premillennialists — who believe biblical prophecy prescribes a plan requiring Israel's existence and Middle East conflict to trigger the Second Coming — are the most organized and fanatical group, and are actively promoting war between Israel and Iran. The lecture concludes by arguing that growing inequality under the Pax Americana will drive more people toward these apocalyptic beliefs, making conflict increasingly likely.",
  "thesis": {
    "central_thesis": "The Israel-Iran conflict is fundamentally driven by Christian Zionism and dispensationalist premillennialism, which treats biblical prophecy as an actionable plan requiring Middle East conflict to bring about the Second Coming of Jesus, and this religious worldview will only grow in influence as inequality increases.",
    "supporting_claims": [
      "The United States will invade Iran within two to six years, driven by three forces: imperial defense, ally pressure from Saudi Arabia and Israel, and the Israel Lobby.",
      "Christianity began as a revolutionary, egalitarian, anti-authority religion appealing to the oppressed, functioning as a 'free lottery ticket' for those with no hope.",
      "Augustine transformed Christianity into an establishment religion by reinterpreting the Second Coming as metaphorical (amillennialism), removing its revolutionary urgency.",
      "America was founded as a Christian nation by Protestant dissenters sent from England, with the Bible as the supreme authority — not as the secular, multicultural nation it appears from the outside.",
      "Dispensationalist premillennialists believe the Bible contains a literal plan for bringing about the Second Coming: Israel must exist as a Jewish nation, the Temple must be rebuilt, and Armageddon must occur.",
      "Christian Zionism uses the Jewish people as a tool to fulfill biblical prophecy, and is considered blasphemous by most Christians because it attempts to manipulate God.",
      "Christian Zionism preceded and enabled Jewish Zionism — before Christian Zionism, Jews identified primarily as members of their national communities rather than as a separate race requiring their own state.",
      "Israel exploits Christian Zionism to advance its geopolitical interests, knowing America will fight its wars due to religious obligation.",
      "Growing inequality under the Pax Americana, like inequality under the Pax Romana, drives people toward apocalyptic religious beliefs, making dispensationalist premillennialism increasingly popular."
    ],
    "predictions": [
      {
        "claim": "The United States will invade Iran, possibly within two to six years.",
        "type": "prediction",
        "timestamp": "00:00:11",
        "falsifiable": true,
        "status": "partially_confirmed",
        "status_note": "May 1, 2026: The US launched Operation Midnight Hammer (June 2025) and a full-scale air/missile campaign with Israel (Feb 28, 2026, 900+ strikes). Naval blockade since Apr 13. NO ground invasion as of Day 63. Apr 30 CENTCOM/Caine first cabinet-level presentation of military options including Hormuz seizure that 'could include ground forces' — first material upward shift in ground-ops probability since war began, but Trump has not ordered kinetic ground action; only 192nd MP Battalion (~150 NG logistics) deployed. Timeline was correct (~1.5 years) but the form has been air/missile/naval, not ground invasion. [June 1, 2026 update] The air/missile/naval form is confirmed; the ground-troops element remains unrealized, and the near-term trajectory is now de-escalation. As of June 1, 2026 (Day 95) there are still ZERO US ground troops in Iran. Since the Apr 30 Cooper/Caine cabinet briefing that first put ground-inclusive options on the table, the trajectory reversed toward de-escalation: through late May US and Iranian negotiators reached a tentative 60-day ceasefire MOU (Iran pledging never to develop or purchase a nuclear weapon; a negotiated Hormuz reopening with no tolls + Iranian mine-clearing + proportional blockade lift), pending final approval by Trump and Mojtaba Khamenei -- not signed as of June 1 (Trump requested edits May 31 rather than signing). The principal US instrument remains the naval blockade (CENTCOM: ~118 vessels redirected + 5 disabled). The named deal-failure alternative is an air/strike package ('end it a different way'; Hegseth at the Shangri-La Dialogue: 'more than capable' of resuming strikes), not a ground order. No new ground-deployment order, no third ARG, no draft. Israel's capture of Beaufort Castle in Lebanon (May 31) is an Israeli ground operation in Lebanon, NOT US ground troops in Iran. [August 1, 2026 monthly update — Day 156] Still ZERO US ground troops in Iran; the war remains air, naval and maritime-interdiction only. Since the June 1 scoring the record has moved substantially — and net downward on the ground rung. A thirteen-night US air campaign (July 12-25) ended in a pause on July 25-26; strikes resumed July 30 with a 'heavy wave' against dozens of IRGC targets along the Gulf littoral (Bandar Abbas, Qeshm, Kish, Abu Musa, Bushehr, Kazerun, Farashband, Abadan, Ahvaz) — but NOT Kharg. On July 31 four outlets (WSJ, CBS, CNN, Axios) reported a multi-day campaign against power plants, refineries, Tehran's electricity grid and dual-use bridges, framed as forcing capitulation ('At some point, they're going to say, We just can't take it anymore'). NO ground element and NO Kharg operation appears in any version of that reporting. The amphibious rung actually FELL: on July 26 the Tripoli ARG offloaded ~2,500 Marines of the 31st MEU at Okinawa with no relief ARG announced, leaving USS Boxer the sole deployed ARG fleet-wide. Foreign Policy's survey of former commanders (July 27) found the US 'does not appear to be moving toward a major ground operation in Iran,' and Trump said on July 22 'we have other people that will do the ground campaign for us.' Countervailing signals exist and are logged: the Pentagon was reported on July 24 readying options for weeks of limited ground operations (Kharg plus coastal raids) pending approval, and July 30 produced the war's first ambiguous shaping signal — but every EXECUTION indicator remains at zero: no landing, no embarkation, no MEU tasking, no airborne insertion, no draft. Independent confirmation this cycle: CFR's Global Conflict Tracker records that 'no significant US ground force commitment is documented' and that operations have 'remained primarily aerial and naval.' The Kharg seizure requirement is still assessed at ~1,200+ troops against anti-personnel and anti-armour mines emplaced on the landing shoreline itself plus added MANPADS, with experts calling holding the island the harder problem. US theatre strength is above 50,000 — roughly 10,000 above baseline — and none of it is inside Iran. US casualties stand at 18 KIA / 685 wounded; CFR records ~1,701 documented Iranian civilian deaths, up to 3.2 million displaced, and a ~$37.5B war cost. [September 1, 2026 monthly update — Day 187] Still **ZERO US ground troops inside Iran**, for a **187th consecutive day** — and this cycle produced the war's two hardest pieces of documentary evidence on the ground question, one of which corrects this audit's own record. THE CORRECTION THIS AUDIT OWES. On August 30-31 the Army extended the Middle East deployment of elements of the **82nd Airborne Division** to a **full twelve months**, carrying soldiers into **2027**, announced by letter from division commander **Maj. Gen. Brandon R. Tegtmeier**: *“We do not share that lightly, and we understand that a longer tour weighs heavily on every household, including our own.”* The published unit list is the material fact — **Division Headquarters, 1st Brigade Combat Team, Combat Aviation Brigade, DIVARTY, the 307th Division Engineer Battalion, 3rd Battalion 4th Air Defense Artillery** and a sustainment element, **approximately 2,000 soldiers**, deployed from Fort Bragg in **March 2026**. This audit had carried “~1,000 paratroopers” and the standing statement that no brigade combat team, division headquarters or corps-level enabler set had been identified in theatre at any point in the war. **Both were wrong and are corrected here.** The correction is to the record and not to the disposition — no unit moved in this cycle; the extension letter is simply what made the composition public. **What the extension is not:** it adds no soldiers, moves nobody forward, changes no mission and names no objective. Extending tours to twelve months is what a volunteer force does when it has no replacements, which is the inverse of the concentration signature this audit watches for. THE DOCUMENT THAT EXPLAINS THE FIRST. *The Washington Post* published contents of the **August 14 edition of the Secretary of Defense Orders Book**, the classified twice-monthly document allocating warships, aircraft, pe